{
  "SessionStart": [
    {
      "matcher": "",
      "hooks": [
        {
          "type": "prompt",
          "prompt": "SDLC Orchestration plugin active. Available workflows:\n- /sdlc-orchestration:full-feature - Complete SDLC with parallel agents\n- /sdlc-orchestration:phase <phase> - Run specific phase\n- /sdlc-orchestration:research - Parallel research with 3 agents (includes skill search)\n- /sdlc-orchestration:role <role> - Single role agent\n\nPhases: requirements, design, implement, quality, release\nRoles: ceo, pm, architect, ba, research, staff, senior, junior, qa, reviewer, devops, network, cicd, canary, docs, perf, data\n\n⚠️ ENFORCEMENT ACTIVE:\n- Research tasks REQUIRE /sdlc-orchestration:research (WebSearch blocked otherwise)\n- Feature implementation REQUIRES /sdlc-orchestration:full-feature\n- User confirmation required before bypassing workflows"
        }
      ]
    }
  ],
  "UserPromptSubmit": [
    {
      "matcher": "",
      "hooks": [
        {
          "type": "command",
          "command": "bash -c 'INPUT=$(cat); PROMPT=$(echo \"$INPUT\" | jq -r \".prompt // empty\" 2>/dev/null); if [ -n \"$PROMPT\" ] && echo \"$PROMPT\" | grep -qiE \"(implement|build|create|develop|add).*(feature|module|system|service|functionality)\"; then echo \"{\\\"addToPrompt\\\": \\\"[SDLC REQUIRED] Use /sdlc-orchestration:full-feature for structured development. Do NOT proceed without invoking the workflow.\\\"}\"; fi'",
          "timeout": 5
        },
        {
          "type": "command",
          "command": "bash -c 'INPUT=$(cat); PROMPT=$(echo \"$INPUT\" | jq -r \".prompt // empty\" 2>/dev/null); BYPASS_FILE=\"${CLAUDE_PROJECT_ROOT:-.}/.claude/sdlc-research-bypass.json\"; RESEARCH_FILE=\"${CLAUDE_PROJECT_ROOT:-.}/.claude/sdlc-research-active.json\"; if [ -n \"$PROMPT\" ] && echo \"$PROMPT\" | grep -qiE \"(research|investigate|evaluate|compare|analyze|review|audit|assess).*(technolog|librar|framework|tool|skill|approach|option|solution|pattern)\"; then if [ ! -f \"$RESEARCH_FILE\" ] && [ ! -f \"$BYPASS_FILE\" ]; then CONFIRM_FILE=\"${CLAUDE_PROJECT_ROOT:-.}/.claude/sdlc-pending-confirm.json\"; mkdir -p \"$(dirname \"$CONFIRM_FILE\")\"; echo \"{\\\"type\\\":\\\"research\\\",\\\"detected_at\\\":\\\"$(date -u +%Y-%m-%dT%H:%M:%SZ)\\\"}\" > \"$CONFIRM_FILE\"; echo \"{\\\"addToPrompt\\\": \\\"[SDLC CONFIRMATION REQUIRED]\\n\\nResearch task detected. You MUST ask the user:\\n\\n> This looks like a research task. I should use /sdlc-orchestration:research to spawn 3 parallel agents (Research Scientist, Business Analyst, Software Architect) for comprehensive investigation.\\n>\\n> Options:\\n> 1. Yes, use research workflow (recommended)\\n> 2. No, I want manual research (creates bypass)\\n>\\n> Which do you prefer?\\n\\nDo NOT proceed with any research tools until user responds.\\\"}\"; fi; fi'",
          "timeout": 5
        },
        {
          "type": "command",
          "command": "bash -c 'INPUT=$(cat); PROMPT=$(echo \"$INPUT\" | jq -r \".prompt // empty\" 2>/dev/null); BYPASS_FILE=\"${CLAUDE_PROJECT_ROOT:-.}/.claude/sdlc-research-bypass.json\"; RESEARCH_FILE=\"${CLAUDE_PROJECT_ROOT:-.}/.claude/sdlc-research-active.json\"; if [ -n \"$PROMPT\" ] && echo \"$PROMPT\" | grep -qiE \"(find|search|add|install).*(skill|plugin|agent|mcp)\"; then if [ ! -f \"$RESEARCH_FILE\" ] && [ ! -f \"$BYPASS_FILE\" ]; then CONFIRM_FILE=\"${CLAUDE_PROJECT_ROOT:-.}/.claude/sdlc-pending-confirm.json\"; mkdir -p \"$(dirname \"$CONFIRM_FILE\")\"; echo \"{\\\"type\\\":\\\"skill-discovery\\\",\\\"detected_at\\\":\\\"$(date -u +%Y-%m-%dT%H:%M:%SZ)\\\"}\" > \"$CONFIRM_FILE\"; echo \"{\\\"addToPrompt\\\": \\\"[SDLC CONFIRMATION REQUIRED]\\n\\nSkill/plugin discovery detected. You MUST ask the user:\\n\\n> This is a skill discovery task. I should use /sdlc-orchestration:research for parallel investigation.\\n>\\n> Options:\\n> 1. Yes, use research workflow (recommended)\\n> 2. No, I want manual search (creates bypass)\\n>\\n> Which do you prefer?\\n\\nDo NOT proceed until user responds.\\\"}\"; fi; fi'",
          "timeout": 5
        },
        {
          "type": "command",
          "command": "bash -c 'INPUT=$(cat); PROMPT=$(echo \"$INPUT\" | jq -r \".prompt // empty\" 2>/dev/null); CONFIRM_FILE=\"${CLAUDE_PROJECT_ROOT:-.}/.claude/sdlc-pending-confirm.json\"; BYPASS_FILE=\"${CLAUDE_PROJECT_ROOT:-.}/.claude/sdlc-research-bypass.json\"; if [ -f \"$CONFIRM_FILE\" ]; then if echo \"$PROMPT\" | grep -qiE \"(yes|option 1|use research|recommended)\"; then rm -f \"$CONFIRM_FILE\"; echo \"{\\\"addToPrompt\\\": \\\"[SDLC] User confirmed research workflow. Now invoke /sdlc-orchestration:research with the original task.\\\"}\"; elif echo \"$PROMPT\" | grep -qiE \"(no|option 2|manual|bypass)\"; then rm -f \"$CONFIRM_FILE\"; mkdir -p \"$(dirname \"$BYPASS_FILE\")\"; echo \"{\\\"bypassed_at\\\":\\\"$(date -u +%Y-%m-%dT%H:%M:%SZ)\\\",\\\"reason\\\":\\\"user_requested\\\"}\" > \"$BYPASS_FILE\"; echo \"{\\\"addToPrompt\\\": \\\"[SDLC] User chose manual research. Bypass granted for this session. Proceeding without parallel agents.\\\"}\"; fi; fi'",
          "timeout": 5
        },
        {
          "type": "command",
          "command": "bash -c 'INPUT=$(cat); PROMPT=$(echo \"$INPUT\" | jq -r \".prompt // empty\" 2>/dev/null); if echo \"$PROMPT\" | grep -qiE \"sdlc-orchestration:research\"; then RESEARCH_FILE=\"${CLAUDE_PROJECT_ROOT:-.}/.claude/sdlc-research-active.json\"; CONFIRM_FILE=\"${CLAUDE_PROJECT_ROOT:-.}/.claude/sdlc-pending-confirm.json\"; mkdir -p \"$(dirname \"$RESEARCH_FILE\")\"; echo \"{\\\"started_at\\\":\\\"$(date -u +%Y-%m-%dT%H:%M:%SZ)\\\",\\\"status\\\":\\\"active\\\"}\" > \"$RESEARCH_FILE\"; rm -f \"$CONFIRM_FILE\" 2>/dev/null; echo \"{\\\"addToPrompt\\\": \\\"[SDLC] Research workflow activated. Parallel agents enabled.\\\"}\"; fi'",
          "timeout": 5
        },
        {
          "type": "command",
          "command": "bash -c 'INPUT=$(cat); PROMPT=$(echo \"$INPUT\" | jq -r \".prompt // empty\" 2>/dev/null); STATE_FILE=\"${CLAUDE_PROJECT_ROOT:-.}/.claude/sdlc-state.json\"; if [ -f \"$STATE_FILE\" ]; then PHASE=$(jq -r \".current_phase // empty\" \"$STATE_FILE\" 2>/dev/null); if [ \"$PHASE\" = \"requirements\" ] && echo \"$PROMPT\" | grep -qiE \"(implement|code|build)\"; then echo \"{\\\"addToPrompt\\\": \\\"[SDLC Gate] Design phase must complete before implementation. Current phase: requirements.\\\"}\"; elif [ \"$PHASE\" = \"design\" ] && echo \"$PROMPT\" | grep -qiE \"(deploy|release|production)\"; then echo \"{\\\"addToPrompt\\\": \\\"[SDLC Gate] Implementation and quality phases must complete before release. Current phase: design.\\\"}\"; fi; fi'",
          "timeout": 5
        },
        {
          "type": "command",
          "command": "bash -c 'INPUT=$(cat); PROMPT=$(echo \"$INPUT\" | jq -r \".prompt // empty\" 2>/dev/null); if echo \"$PROMPT\" | grep -qiE \"sdlc-orchestration:(full-feature|phase).*\"; then STATE_FILE=\"${CLAUDE_PROJECT_ROOT:-.}/.claude/sdlc-state.json\"; FEATURE=$(echo \"$PROMPT\" | sed -n \"s/.*[\\\"\\x27]\\([^\\\"\\x27]*\\)[\\\"\\x27].*/\\1/p\" | head -1); if [ ! -f \"$STATE_FILE\" ] || [ -n \"$FEATURE\" ]; then mkdir -p \"$(dirname \"$STATE_FILE\")\"; TIMESTAMP=$(date -u +%Y-%m-%dT%H:%M:%SZ); cat > \"$STATE_FILE\" <<EOF\n{\"track_id\":\"$(echo \"$FEATURE\" | tr \" \" \"-\" | tr \"[:upper:]\" \"[:lower:]\" | head -c 50)\",\"current_phase\":\"requirements\",\"started_at\":\"$TIMESTAMP\",\"phases\":{\"requirements\":{\"status\":\"in_progress\",\"started_at\":\"$TIMESTAMP\"},\"design\":{\"status\":\"pending\"},\"implementation\":{\"status\":\"pending\"},\"quality\":{\"status\":\"pending\"},\"release\":{\"status\":\"pending\"}}}\nEOF\necho \"{\\\"addToPrompt\\\": \\\"[SDLC] Created state file: $STATE_FILE. Phase tracking is now active.\\\"}\"; fi; fi'",
          "timeout": 5
        },
        {
          "type": "command",
          "command": "bash -c 'INPUT=$(cat); PROMPT=$(echo \"$INPUT\" | jq -r \".prompt // empty\" 2>/dev/null); SYNC_FILE=\"${CLAUDE_PROJECT_ROOT:-.}/.claude/sdlc-doc-sync.json\"; if [ -f \"$SYNC_FILE\" ]; then PENDING=$(jq -r \".pending_sync // false\" \"$SYNC_FILE\" 2>/dev/null); if [ \"$PENDING\" = \"true\" ] && echo \"$PROMPT\" | grep -qiE \"(commit|push|deploy|release|done|complete|finish|merge|pr|pull.?request)\"; then CODE_COUNT=$(jq \".code_changes | length\" \"$SYNC_FILE\" 2>/dev/null); REQ_COUNT=$(jq \".requirements_changes | length\" \"$SYNC_FILE\" 2>/dev/null); echo \"{\\\"addToPrompt\\\": \\\"[SDLC DOC-SYNC REQUIRED]\\n\\nDocumentation is out of sync:\\n- Code files changed: $CODE_COUNT\\n- Requirements/plan files changed: $REQ_COUNT\\n\\nBefore proceeding with commit/deploy/release, you SHOULD:\\n1. Invoke documentation-engineer agent to update relevant docs\\n2. Or explicitly acknowledge: \\\\\\\"skip doc sync\\\\\\\" to proceed without updating\\n\\nSuggested command: Use Task tool with documentation-generator:technical-writer to sync documentation.\\\"}\"; fi; fi; exit 0'",
          "timeout": 5
        },
        {
          "type": "command",
          "command": "bash -c 'INPUT=$(cat); PROMPT=$(echo \"$INPUT\" | jq -r \".prompt // empty\" 2>/dev/null); SYNC_FILE=\"${CLAUDE_PROJECT_ROOT:-.}/.claude/sdlc-doc-sync.json\"; if echo \"$PROMPT\" | grep -qiE \"skip doc.?sync\"; then if [ -f \"$SYNC_FILE\" ]; then jq \".pending_sync = false | .skipped_at = \\\"$(date -u +%Y-%m-%dT%H:%M:%SZ)\\\"\" \"$SYNC_FILE\" > \"${SYNC_FILE}.tmp\" && mv \"${SYNC_FILE}.tmp\" \"$SYNC_FILE\" 2>/dev/null; echo \"{\\\"addToPrompt\\\": \\\"[SDLC DOC-SYNC] Documentation sync skipped by user acknowledgment. Proceeding without doc update.\\\"}\"; fi; fi; exit 0'",
          "timeout": 5
        }
      ]
    }
  ],
  "PreToolUse": [
    {
      "matcher": "WebSearch",
      "hooks": [
        {
          "type": "command",